audio_path,duration,text,subject_id,utt_id,accent,source_split_file
/data/mtseng/voice_datasets/CommonVoice_v11/data/sample-13/wav/sample-132703.wav,4.2,LEMON TREES ARE NOT YELLOW IT'S JUST THE FRUIT,sample-13,sample-132703,scottish,train.csv
/data/mtseng/voice_datasets/CommonVoice_v11/data/sample-13/wav/sample-132841.wav,4.392,HIRES TWO PERSONAL TRAINERS AND MAKE ONE OF THEM TRAIN THE OTHER ONE,sample-13,sample-132841,scottish,train.csv
/data/mtseng/voice_datasets/CommonVoice_v11/data/sample-13/wav/sample-132953.wav,4.464,EVEN FROM A DISTANCE THEIR EYES CONVEYED THE STRENGTH OF THEIR SOULS,sample-13,sample-132953,scottish,train.csv
/data/mtseng/voice_datasets/CommonVoice_v11/data/sample-13/wav/sample-133068.wav,4.128,THE BURNING FIRE HAD BEEN EXTINGUISHED,sample-13,sample-133068,scottish,train.csv
/data/mtseng/voice_datasets/CommonVoice_v11/data/sample-13/wav/sample-133566.wav,2.184,MANY TELESCOPES WERE POINTED AT IT,sample-13,sample-133566,scottish,train.csv
/data/mtseng/voice_datasets/CommonVoice_v11/data/sample-13/wav/sample-133641.wav,2.976,NEVER GIVE UP,sample-13,sample-133641,scottish,train.csv
/data/mtseng/voice_datasets/CommonVoice_v11/data/sample-13/wav/sample-133806.wav,4.536,BECAUSE YOU'LL KNOW ITS DREAMS AND WISHES AND WILL KNOW HOW TO DEAL WITH THEM,sample-13,sample-133806,scottish,train.csv
/data/mtseng/voice_datasets/CommonVoice_v11/data/sample-13/wav/sample-133892.wav,3.888,JUST BY LOOKING AT THEM,sample-13,sample-133892,scottish,train.csv
/data/mtseng/voice_datasets/CommonVoice_v11/data/sample-13/wav/sample-134041.wav,2.616,THE INSURANCE WAS SKY HIGH,sample-13,sample-134041,scottish,train.csv
/data/mtseng/voice_datasets/CommonVoice_v11/data/sample-13/wav/sample-134077.wav,2.712,YOU'RE STILL A GOOD REPORTER,sample-13,sample-134077,scottish,train.csv
/data/mtseng/voice_datasets/CommonVoice_v11/data/sample-13/wav/sample-134236.wav,2.904,I FOUND THESE ONE DAY IN THE FIELDS,sample-13,sample-134236,scottish,train.csv
/data/mtseng/voice_datasets/CommonVoice_v11/data/sample-13/wav/sample-134253.wav,3.504,WHAT DO I DO IN SALEM THE OLD MAN LAUGHED,sample-13,sample-134253,scottish,train.csv
/data/mtseng/voice_datasets/CommonVoice_v11/data/sample-13/wav/sample-134287.wav,3.216,THE STICKER WAS PEELING FROM THE ITEM,sample-13,sample-134287,scottish,train.csv
/data/mtseng/voice_datasets/CommonVoice_v11/data/sample-13/wav/sample-134394.wav,4.104,IT WAS DROPPING OFF IN FLAKES AND RAINING DOWN ON THE SAND,sample-13,sample-134394,scottish,train.csv
/data/mtseng/voice_datasets/CommonVoice_v11/data/sample-13/wav/sample-134434.wav,3.264,THEN WHO ARE YOU,sample-13,sample-134434,scottish,train.csv
/data/mtseng/voice_datasets/CommonVoice_v11/data/sample-13/wav/sample-134442.wav,2.88,I KNOW YOU'LL PAY IT BACK WHEN YOU CAN,sample-13,sample-134442,scottish,train.csv
/data/mtseng/voice_datasets/CommonVoice_v11/data/sample-13/wav/sample-134510.wav,2.736,IT BROUGHT HIS HEART INTO HIS MOUTH,sample-13,sample-134510,scottish,train.csv
/data/mtseng/voice_datasets/CommonVoice_v11/data/sample-13/wav/sample-134556.wav,2.448,WHAT ARE YOU LOOKING FOR,sample-13,sample-134556,scottish,train.csv
/data/mtseng/voice_datasets/CommonVoice_v11/data/sample-13/wav/sample-134632.wav,5.736,PEOPLE CONTINUED TO COME AND GO FROM THE BAKER'S SHOP,sample-13,sample-134632,scottish,train.csv
/data/mtseng/voice_datasets/CommonVoice_v11/data/sample-13/wav/sample-134654.wav,2.136,ONLY ONE WAY YOU CAN HELP ME,sample-13,sample-134654,scottish,train.csv
/data/mtseng/voice_datasets/CommonVoice_v11/data/sample-13/wav/sample-134708.wav,4.632,I DON'T KNOW IF I'LL BE ABLE TO FIND LIFE IN THE DESERT THE BOY THOUGHT,sample-13,sample-134708,scottish,train.csv
/data/mtseng/voice_datasets/CommonVoice_v11/data/sample-13/wav/sample-135027.wav,4.056,NOPE NOT GOING UNLESS THEY HAVE A GIANT INFLATABLE SLIDE,sample-13,sample-135027,scottish,train.csv
/data/mtseng/voice_datasets/CommonVoice_v11/data/sample-13/wav/sample-135125.wav,3.744,HE WAS JUST AND GOOD,sample-13,sample-135125,scottish,train.csv
/data/mtseng/voice_datasets/CommonVoice_v11/data/sample-13/wav/sample-135624.wav,4.344,WITH THE GIRL WITH THE RAVEN HAIR HIS DAYS WOULD NEVER BE THE SAME AGAIN,sample-13,sample-135624,scottish,train.csv
/data/mtseng/voice_datasets/CommonVoice_v11/data/sample-13/wav/sample-135690.wav,1.776,IS IT ALL RIGHT,sample-13,sample-135690,scottish,train.csv
/data/mtseng/voice_datasets/CommonVoice_v11/data/sample-13/wav/sample-135881.wav,2.184,I HOPE SOME OF THE LINES MAKE YOU SMILE,sample-13,sample-135881,scottish,train.csv
/data/mtseng/voice_datasets/CommonVoice_v11/data/sample-13/wav/sample-136029.wav,3.144,MISTER KRISTEN HAS SOMETHING TO SAY TO US,sample-13,sample-136029,scottish,train.csv
/data/mtseng/voice_datasets/CommonVoice_v11/data/sample-13/wav/sample-136456.wav,5.184,IT WAS NO MORE EXCITING THAN AN OVERTURNED CARRIAGE OR A TREE BLOWN ACROSS THE ROAD,sample-13,sample-136456,scottish,train.csv
/data/mtseng/voice_datasets/CommonVoice_v11/data/sample-13/wav/sample-136647.wav,4.152,I'M NOT FAMILIAR WITH THE BOOKS THIS AUTHOR WROTE,sample-13,sample-136647,scottish,train.csv
/data/mtseng/voice_datasets/CommonVoice_v11/data/sample-13/wav/sample-136943.wav,4.104,YES THAT'S WHAT LOVE IS,sample-13,sample-136943,scottish,train.csv
/data/mtseng/voice_datasets/CommonVoice_v11/data/sample-13/wav/sample-136969.wav,3.336,THE BOY PICKED UP HIS POUCH AND PUT IT WITH HIS OTHER THINGS,sample-13,sample-136969,scottish,train.csv
/data/mtseng/voice_datasets/CommonVoice_v11/data/sample-13/wav/sample-136994.wav,5.28,THEN HE TURNED TO THE BOY THIS TIME HIS EXPRESSION WAS COLD AND DISTANT,sample-13,sample-136994,scottish,train.csv
/data/mtseng/voice_datasets/CommonVoice_v11/data/sample-13/wav/sample-137090.wav,3.192,AND ONE OR TWO PERSONS WERE RETURNING,sample-13,sample-137090,scottish,train.csv
/data/mtseng/voice_datasets/CommonVoice_v11/data/sample-13/wav/sample-137339.wav,1.416,WAIT A MINUTE HERE,sample-13,sample-137339,scottish,train.csv
/data/mtseng/voice_datasets/CommonVoice_v11/data/sample-13/wav/sample-137349.wav,4.752,HE THOUGHT THAT WITH SOME PATIENCE HE'D BE ABLE TO TRANSFORM EVERYTHING INTO GOLD,sample-13,sample-137349,scottish,train.csv
/data/mtseng/voice_datasets/CommonVoice_v11/data/sample-13/wav/sample-137482.wav,6.984,WE'LL LEAVE TOMORROW BEFORE SUNRISE WAS THE ALCHEMIST'S ONLY RESPONSE,sample-13,sample-137482,scottish,train.csv
/data/mtseng/voice_datasets/CommonVoice_v11/data/sample-13/wav/sample-137497.wav,2.184,NOW LISTEN TO ME,sample-13,sample-137497,scottish,train.csv
/data/mtseng/voice_datasets/CommonVoice_v11/data/sample-13/wav/sample-137579.wav,4.896,I JUST DON'T TRUST ANYONE WHO SAYS THEY'VE NEVER HAD HAMBURGER HELPER,sample-13,sample-137579,scottish,train.csv
/data/mtseng/voice_datasets/CommonVoice_v11/data/sample-13/wav/sample-137616.wav,5.304,MY SEVEN YEAR RESUME GAP IS MARKED NOT DRUGS,sample-13,sample-137616,scottish,train.csv
/data/mtseng/voice_datasets/CommonVoice_v11/data/sample-13/wav/sample-138084.wav,5.304,AND IT'S NOT LOVE TO SEE EVERYTHING FROM A DISTANCE LIKE YOU DO,sample-13,sample-138084,scottish,train.csv
/data/mtseng/voice_datasets/CommonVoice_v11/data/sample-13/wav/sample-138286.wav,3.504,HEEHAW AND MERRY CHRISTMAS,sample-13,sample-138286,scottish,train.csv
/data/mtseng/voice_datasets/CommonVoice_v11/data/sample-13/wav/sample-138562.wav,4.992,THERE WERE REALLY I THINK TWO OR THREE HUNDRED PEOPLE ELBOWING ONE ANOTHER,sample-13,sample-138562,scottish,train.csv
/data/mtseng/voice_datasets/CommonVoice_v11/data/sample-13/wav/sample-138965.wav,3.144,IT WAS A PLEASANT CHANGE FROM TALKING TO HIS SHEEP,sample-13,sample-138965,scottish,train.csv
/data/mtseng/voice_datasets/CommonVoice_v11/data/sample-13/wav/sample-139341.wav,5.016,THE ANGEL TOUCHED THE MAN'S SHOULDER AND THEY WERE BOTH PROJECTED FAR INTO THE FUTURE,sample-13,sample-139341,scottish,train.csv
/data/mtseng/voice_datasets/CommonVoice_v11/data/sample-13/wav/sample-139844.wav,2.856,ARE YOU GOING TO LIVE WITH YOUR MOTHER,sample-13,sample-139844,scottish,train.csv
/data/mtseng/voice_datasets/CommonVoice_v11/data/sample-13/wav/sample-139869.wav,3.36,SO HOW WILL WE NAME ALL THESE HURRICANES,sample-13,sample-139869,scottish,train.csv
/data/mtseng/voice_datasets/CommonVoice_v11/data/sample-13/wav/sample-139883.wav,3.744,THAT'S WHAT ALCHEMISTS DO,sample-13,sample-139883,scottish,train.csv
/data/mtseng/voice_datasets/CommonVoice_v11/data/sample-14/wav/sample-140081.wav,2.544,YOU'LL GET YOUR MONEY IN SIXTY DAYS,sample-14,sample-140081,scottish,train.csv
/data/mtseng/voice_datasets/CommonVoice_v11/data/sample-14/wav/sample-140212.wav,2.928,I NOTICE YOU STILL REMEMBER IT,sample-14,sample-140212,scottish,train.csv
/data/mtseng/voice_datasets/CommonVoice_v11/data/sample-14/wav/sample-140343.wav,3.096,I COULDN'T ASCERTAIN THE REASON,sample-14,sample-140343,scottish,train.csv
/data/mtseng/voice_datasets/CommonVoice_v11/data/sample-14/wav/sample-140842.wav,4.032,MOST METEORITES ARE MORE OR LESS ROUNDED,sample-14,sample-140842,scottish,train.csv
/data/mtseng/voice_datasets/CommonVoice_v11/data/sample-14/wav/sample-141319.wav,2.304,I SHOULDN'T HAVE DONE THAT,sample-14,sample-141319,scottish,train.csv
/data/mtseng/voice_datasets/CommonVoice_v11/data/sample-14/wav/sample-141416.wav,2.784,THEY PLAY DUETS TOGETHER,sample-14,sample-141416,scottish,train.csv
/data/mtseng/voice_datasets/CommonVoice_v11/data/sample-14/wav/sample-141509.wav,1.656,I NEVER SAID I'D TAKE IT,sample-14,sample-141509,scottish,train.csv
/data/mtseng/voice_datasets/CommonVoice_v11/data/sample-14/wav/sample-141540.wav,6.048,IT WOULD HAVE BEEN VISIBLE TO ME HAD I ONLY LOOKED UP AS IT PASSED,sample-14,sample-141540,scottish,train.csv
/data/mtseng/voice_datasets/CommonVoice_v11/data/sample-14/wav/sample-141695.wav,3.024,GO ON OUT AND GET RID OF IT,sample-14,sample-141695,scottish,train.csv
/data/mtseng/voice_datasets/CommonVoice_v11/data/sample-14/wav/sample-141954.wav,3.096,THEY NEVER HAVE TO MAKE ANY DECISIONS HE THOUGHT,sample-14,sample-141954,scottish,train.csv
/data/mtseng/voice_datasets/CommonVoice_v11/data/sample-14/wav/sample-142013.wav,2.856,CAME TO THE BAR HE HAD ENTERED ON HIS FIRST DAY THERE,sample-14,sample-142013,scottish,train.csv
/data/mtseng/voice_datasets/CommonVoice_v11/data/sample-14/wav/sample-142084.wav,3.024,BESIDES THAT THERE WAS A HEAP OF BICYCLES,sample-14,sample-142084,scottish,train.csv
/data/mtseng/voice_datasets/CommonVoice_v11/data/sample-14/wav/sample-142134.wav,8.064,I REMEMBER HOW I SAT ON THE TABLE THERE IN THE BLACKNESS WITH PATCHES OF GREEN AND CRIMSON SWIMMING BEFORE MY EYES,sample-14,sample-142134,scottish,train.csv
/data/mtseng/voice_datasets/CommonVoice_v11/data/sample-14/wav/sample-142387.wav,3.864,CARBON DIOXIDE IS CAUSING GLOBAL WARMING,sample-14,sample-142387,scottish,train.csv
/data/mtseng/voice_datasets/CommonVoice_v11/data/sample-14/wav/sample-142546.wav,5.376,AND ALSO BY UNHAPPINESS ENVY AND JEALOUSY,sample-14,sample-142546,scottish,train.csv
/data/mtseng/voice_datasets/CommonVoice_v11/data/sample-14/wav/sample-142749.wav,3.96,THE TOP HAD CERTAINLY CEASED TO ROTATE,sample-14,sample-142749,scottish,train.csv
/data/mtseng/voice_datasets/CommonVoice_v11/data/sample-14/wav/sample-142776.wav,4.68,THE TAYLOR JEAN MOVEMENT ISN'T DEAD YET,sample-14,sample-142776,scottish,train.csv
/data/mtseng/voice_datasets/CommonVoice_v11/data/sample-14/wav/sample-142830.wav,1.752,WHAT ARE YOU DOING HERE,sample-14,sample-142830,scottish,train.csv
/data/mtseng/voice_datasets/CommonVoice_v11/data/sample-14/wav/sample-142833.wav,3.216,THE LED MONITOR WAS CRACKED QUITE BADLY,sample-14,sample-142833,scottish,train.csv
/data/mtseng/voice_datasets/CommonVoice_v11/data/sample-14/wav/sample-143148.wav,3.144,BUT HE KNEW THAT SALEM WASN'T IN ANDALUSIA,sample-14,sample-143148,scottish,train.csv
/data/mtseng/voice_datasets/CommonVoice_v11/data/sample-14/wav/sample-143206.wav,2.064,WHAT DOES THAT GET US,sample-14,sample-143206,scottish,train.csv
/data/mtseng/voice_datasets/CommonVoice_v11/data/sample-14/wav/sample-143378.wav,6.24,THE BOY DIDN'T KNOW WHAT A PERSON'S DESTINY WAS,sample-14,sample-143378,scottish,train.csv
/data/mtseng/voice_datasets/CommonVoice_v11/data/sample-14/wav/sample-143384.wav,1.944,BUT A LOVELY CHAP,sample-14,sample-143384,scottish,train.csv
/data/mtseng/voice_datasets/CommonVoice_v11/data/sample-14/wav/sample-143958.wav,2.424,DISREGARD MY LAST STATEMENT,sample-14,sample-143958,scottish,train.csv
/data/mtseng/voice_datasets/CommonVoice_v11/data/sample-14/wav/sample-144100.wav,3.696,WHENEVER HE COULD HE SOUGHT OUT A NEW ROAD TO TRAVEL,sample-14,sample-144100,scottish,train.csv
/data/mtseng/voice_datasets/CommonVoice_v11/data/sample-14/wav/sample-144319.wav,6.024,THE SPY INFILTRATED THE INTERIOR THROUGH A VENT AND SNEAKED TO THE RETINA SCANNER,sample-14,sample-144319,scottish,train.csv
/data/mtseng/voice_datasets/CommonVoice_v11/data/sample-14/wav/sample-144369.wav,2.952,IT'S TOO BAD THAT HE'S QUICKLY GOING TO FORGET MY NAME HE THOUGHT,sample-14,sample-144369,scottish,train.csv
/data/mtseng/voice_datasets/CommonVoice_v11/data/sample-14/wav/sample-144389.wav,3.384,SHE IS A NEIGHBOUR AND SOMETIMES WE MEET IN THE ELEVATOR,sample-14,sample-144389,scottish,train.csv
/data/mtseng/voice_datasets/CommonVoice_v11/data/sample-14/wav/sample-144390.wav,4.248,A PREDATOR DRONE EQUIPPED WITH MULTIPLE CRUISE MISSILES LIFTED OFF,sample-14,sample-144390,scottish,train.csv
/data/mtseng/voice_datasets/CommonVoice_v11/data/sample-14/wav/sample-144657.wav,1.776,BUT NOW I'M SAD AND ALONE,sample-14,sample-144657,scottish,train.csv
/data/mtseng/voice_datasets/CommonVoice_v11/data/sample-14/wav/sample-145003.wav,2.976,WHERE THE SAND WAS MORE SUBSTANTIAL,sample-14,sample-145003,scottish,train.csv
/data/mtseng/voice_datasets/CommonVoice_v11/data/sample-14/wav/sample-145152.wav,4.464,THE ACHIEVED RESULTS ARE FAR BEHIND THE STATEOFTHEART IN IMAGE CLASSIFICATION,sample-14,sample-145152,scottish,train.csv
/data/mtseng/voice_datasets/CommonVoice_v11/data/sample-14/wav/sample-145183.wav,5.592,THEY CALLED IT THE SIMUM AND IT WAS WORSE THAN A STORM AT SEA,sample-14,sample-145183,scottish,train.csv
/data/mtseng/voice_datasets/CommonVoice_v11/data/sample-14/wav/sample-145453.wav,3.264,THE LIGHTBULBS NEED CHANGING AGAIN,sample-14,sample-145453,scottish,train.csv
/data/mtseng/voice_datasets/CommonVoice_v11/data/sample-14/wav/sample-145718.wav,3.096,AS NICE AS BLAKE'S,sample-14,sample-145718,scottish,train.csv
/data/mtseng/voice_datasets/CommonVoice_v11/data/sample-14/wav/sample-145719.wav,3.696,EVEN COMING DOWN ON THE TRAIN TOGETHER SHE WROTE ME,sample-14,sample-145719,scottish,train.csv
/data/mtseng/voice_datasets/CommonVoice_v11/data/sample-14/wav/sample-145747.wav,3.144,IT SEEMED HE HAD MADE THE LONG JOURNEY FOR NOTHING,sample-14,sample-145747,scottish,train.csv
/data/mtseng/voice_datasets/CommonVoice_v11/data/sample-14/wav/sample-145874.wav,4.992,IT LEFT A GREENISH STREAK THAT GLOWED FOR SOME SECONDS,sample-14,sample-145874,scottish,train.csv
/data/mtseng/voice_datasets/CommonVoice_v11/data/sample-14/wav/sample-145959.wav,4.944,THE WHOLE THING SEEMED DEPRESSINGLY FUTILE,sample-14,sample-145959,scottish,train.csv
/data/mtseng/voice_datasets/CommonVoice_v11/data/sample-14/wav/sample-146166.wav,4.704,MAYBE HE SHOULD NOT CALL PEOPLE NAMES THAT THEY DON'T WANT TO BE CALLED,sample-14,sample-146166,scottish,train.csv
/data/mtseng/voice_datasets/CommonVoice_v11/data/sample-14/wav/sample-146197.wav,2.28,AND HE GAVE THE BOY HIS BLESSING,sample-14,sample-146197,scottish,train.csv
/data/mtseng/voice_datasets/CommonVoice_v11/data/sample-14/wav/sample-146238.wav,4.104,NOT ALWAYS IN THIS WAY BUT I ALWAYS APPEAR IN ONE FORM OR ANOTHER,sample-14,sample-146238,scottish,train.csv
/data/mtseng/voice_datasets/CommonVoice_v11/data/sample-14/wav/sample-146379.wav,9.816,LOOKING THROUGH THE TELESCOPE I SAW A CIRCLE OF DEEP BLUE AND THE LITTLE ROUND PLANET,sample-14,sample-146379,scottish,train.csv
/data/mtseng/voice_datasets/CommonVoice_v11/data/sample-14/wav/sample-146465.wav,3.456,LUCY'S A NEWSPAPER WOMAN,sample-14,sample-146465,scottish,train.csv
/data/mtseng/voice_datasets/CommonVoice_v11/data/sample-14/wav/sample-146504.wav,2.928,ELSA KNITTED FURIOUSLY,sample-14,sample-146504,scottish,train.csv
/data/mtseng/voice_datasets/CommonVoice_v11/data/sample-14/wav/sample-146571.wav,2.712,NO MORE WE LIVE LIKE PIGS IN THE FIELD,sample-14,sample-146571,scottish,train.csv
/data/mtseng/voice_datasets/CommonVoice_v11/data/sample-14/wav/sample-146798.wav,2.328,WHAT'S FOR DINNER TONIGHT,sample-14,sample-146798,scottish,train.csv
/data/mtseng/voice_datasets/CommonVoice_v11/data/sample-14/wav/sample-147006.wav,3.216,THEY WERE ALWAYS JUST SOMEBODY TO FILL UP THE BLEACHERS,sample-14,sample-147006,scottish,train.csv
/data/mtseng/voice_datasets/CommonVoice_v11/data/sample-14/wav/sample-147272.wav,3.264,DON'T WORRY I TOOK A CAB TO GET HOME SAFELY,sample-14,sample-147272,scottish,train.csv
/data/mtseng/voice_datasets/CommonVoice_v11/data/sample-14/wav/sample-147468.wav,7.752,AT THAT TIME IT WAS QUITE CLEAR IN MY OWN MIND THAT THE THING HAD COME FROM THE PLANET MARS,sample-14,sample-147468,scottish,train.csv
/data/mtseng/voice_datasets/CommonVoice_v11/data/sample-14/wav/sample-147831.wav,8.04,BEFORE HIM WAS AN ENORMOUS WHITE HORSE REARING OVER HIM WITH A FRIGHTENING SCREAM,sample-14,sample-147831,scottish,train.csv
/data/mtseng/voice_datasets/CommonVoice_v11/data/sample-14/wav/sample-147869.wav,3.984,AT ONCE HE CONNECTED THE TWO INCIDENTS,sample-14,sample-147869,scottish,train.csv
/data/mtseng/voice_datasets/CommonVoice_v11/data/sample-14/wav/sample-147981.wav,6.096,BEFORE LONG MAYBE IN JUST A FEW DAYS HE WOULD BE AT THE PYRAMIDS,sample-14,sample-147981,scottish,train.csv
/data/mtseng/voice_datasets/CommonVoice_v11/data/sample-14/wav/sample-148013.wav,3.096,SHE LEARNED HOW TO PLAY THE PIANO IN A MUSIC SCHOOL,sample-14,sample-148013,scottish,train.csv
/data/mtseng/voice_datasets/CommonVoice_v11/data/sample-14/wav/sample-148221.wav,3.696,IT WAS THE MOST DELICIOUS WINE HE HAD EVER TASTED,sample-14,sample-148221,scottish,train.csv
/data/mtseng/voice_datasets/CommonVoice_v11/data/sample-14/wav/sample-148385.wav,1.824,BUT WHAT'S ALL THIS,sample-14,sample-148385,scottish,train.csv
/data/mtseng/voice_datasets/CommonVoice_v11/data/sample-14/wav/sample-148531.wav,3.384,LOTS OF SHEPHERDS PASSED THROUGH SELLING THEIR WOOL,sample-14,sample-148531,scottish,train.csv
/data/mtseng/voice_datasets/CommonVoice_v11/data/sample-14/wav/sample-148575.wav,5.04,FROM THERE HE COULD SEE AFRICA IN THE DISTANCE,sample-14,sample-148575,scottish,train.csv
/data/mtseng/voice_datasets/CommonVoice_v11/data/sample-14/wav/sample-148611.wav,4.584,THE MERCHANTS WERE ASSEMBLING THEIR STALLS AND THE BOY HELPED A CANDY SELLER TO DO HIS,sample-14,sample-148611,scottish,train.csv
/data/mtseng/voice_datasets/CommonVoice_v11/data/sample-14/wav/sample-148832.wav,3.936,I DON'T CARE WHAT HAPPENS TO ME,sample-14,sample-148832,scottish,train.csv
/data/mtseng/voice_datasets/CommonVoice_v11/data/sample-14/wav/sample-149432.wav,3.648,THE NEXT DAY THE BOY RETURNED TO THE WELL HOPING TO SEE THE GIRL,sample-14,sample-149432,scottish,train.csv
/data/mtseng/voice_datasets/CommonVoice_v11/data/sample-14/wav/sample-149514.wav,3.744,AS HE DID SO HE TALKED WITH THE MONK ABOUT THE TRIBAL WARS,sample-14,sample-149514,scottish,train.csv
/data/mtseng/voice_datasets/CommonVoice_v11/data/sample-14/wav/sample-149580.wav,3.816,FROM THAT DAY ON IT WAS THE DESERT THAT WOULD BE IMPORTANT,sample-14,sample-149580,scottish,train.csv
/data/mtseng/voice_datasets/CommonVoice_v11/data/sample-14/wav/sample-149612.wav,3.48,HE JUST GOT A NEW KITE FOR HIS BIRTHDAY,sample-14,sample-149612,scottish,train.csv
/data/mtseng/voice_datasets/CommonVoice_v11/data/sample-14/wav/sample-149830.wav,2.136,IS IT FOR HUMANS,sample-14,sample-149830,scottish,train.csv
/data/mtseng/voice_datasets/CommonVoice_v11/data/sample-14/wav/sample-149913.wav,5.76,HE DRESSED IN HIS ARABIAN CLOTHING OF WHITE LINEN BOUGHT ESPECIALLY FOR THIS DAY,sample-14,sample-149913,scottish,train.csv
/data/mtseng/voice_datasets/CommonVoice_v11/data/sample-14/wav/sample-149942.wav,3.696,THE SPARROW AND THE SONGBIRD DANCED ALONG THE FENCE,sample-14,sample-149942,scottish,train.csv
/data/mtseng/voice_datasets/CommonVoice_v11/data/sample-15/wav/sample-150009.wav,2.016,IT'S GOT TO BE SOMEWHERE,sample-15,sample-150009,scottish,train.csv
/data/mtseng/voice_datasets/CommonVoice_v11/data/sample-15/wav/sample-150043.wav,2.376,HIS ANXIETY EXPLODED,sample-15,sample-150043,scottish,train.csv
/data/mtseng/voice_datasets/CommonVoice_v11/data/sample-15/wav/sample-150106.wav,2.688,WHICH ONE OF THESE MEN IS IT,sample-15,sample-150106,scottish,train.csv
/data/mtseng/voice_datasets/CommonVoice_v11/data/sample-15/wav/sample-150340.wav,1.632,THE LETTER'S OUR ONLY CLUE,sample-15,sample-150340,scottish,train.csv
/data/mtseng/voice_datasets/CommonVoice_v11/data/sample-15/wav/sample-150493.wav,6.696,AMONG THESE PEOPLE WERE A COUPLE OF CYCLISTS A GARDENER I EMPLOYED SOMETIMES AND A GIRL CARRYING A BABY,sample-15,sample-150493,scottish,train.csv
/data/mtseng/voice_datasets/CommonVoice_v11/data/sample-15/wav/sample-150563.wav,3.696,LIFE ATTRACTS LIFE THE ALCHEMIST ANSWERED,sample-15,sample-150563,scottish,train.csv
/data/mtseng/voice_datasets/CommonVoice_v11/data/sample-15/wav/sample-150950.wav,7.392,LOOKING THROUGH THE TELESCOPE I SAW A CIRCLE OF DEEP BLUE AND THE LITTLE ROUND PLANET,sample-15,sample-150950,scottish,train.csv
/data/mtseng/voice_datasets/CommonVoice_v11/data/sample-15/wav/sample-151009.wav,2.376,WHAT DIFFERENCE DOES IT MAKE WHAT TIME IT IS,sample-15,sample-151009,scottish,train.csv
/data/mtseng/voice_datasets/CommonVoice_v11/data/sample-15/wav/sample-151154.wav,3.264,THEN HE DROPPED HIS SPADE PICKED UP HIS JACKET AND CAME OUT INTO THE ROAD,sample-15,sample-151154,scottish,train.csv
/data/mtseng/voice_datasets/CommonVoice_v11/data/sample-15/wav/sample-151271.wav,4.032,THEY HAD GONE AWAY TO BREAKFAST AT HENDERSON'S HOUSE,sample-15,sample-151271,scottish,train.csv
/data/mtseng/voice_datasets/CommonVoice_v11/data/sample-15/wav/sample-151292.wav,3.096,WELL I SHOULD THINK IT WAS SUDDEN,sample-15,sample-151292,scottish,train.csv
/data/mtseng/voice_datasets/CommonVoice_v11/data/sample-15/wav/sample-152063.wav,5.232,SHOW ME WHERE THERE IS LIFE OUT IN THE DESERT,sample-15,sample-152063,scottish,train.csv
/data/mtseng/voice_datasets/CommonVoice_v11/data/sample-15/wav/sample-152459.wav,3.864,VANESSA CANNOT UNDO HER MISTAKE,sample-15,sample-152459,scottish,train.csv
/data/mtseng/voice_datasets/CommonVoice_v11/data/sample-15/wav/sample-152693.wav,2.88,TODAY'S WORLD IS FULL OF COMMERCIALS,sample-15,sample-152693,scottish,train.csv
/data/mtseng/voice_datasets/CommonVoice_v11/data/sample-15/wav/sample-152791.wav,2.304,CAN'T THEY SEE IT'S A FRAME UP,sample-15,sample-152791,scottish,train.csv
/data/mtseng/voice_datasets/CommonVoice_v11/data/sample-15/wav/sample-152902.wav,3.624,WHEN HE REACHED THE TOP OF THE DUNE HIS HEART LEAPT,sample-15,sample-152902,scottish,train.csv
/data/mtseng/voice_datasets/CommonVoice_v11/data/sample-15/wav/sample-152936.wav,2.448,AND SO WILL YOU,sample-15,sample-152936,scottish,train.csv
/data/mtseng/voice_datasets/CommonVoice_v11/data/sample-15/wav/sample-152956.wav,3.408,AND THEN HE PERCEIVED IT VERY SLOWLY,sample-15,sample-152956,scottish,train.csv
/data/mtseng/voice_datasets/CommonVoice_v11/data/sample-15/wav/sample-153168.wav,3.624,SOME OF OUR BIGGEST CLIENTS ARE AFFECTED,sample-15,sample-153168,scottish,train.csv
/data/mtseng/voice_datasets/CommonVoice_v11/data/sample-15/wav/sample-153477.wav,4.896,THE BOY WAS SURPRISED AT HIS THOUGHTS,sample-15,sample-153477,scottish,train.csv
/data/mtseng/voice_datasets/CommonVoice_v11/data/sample-15/wav/sample-153553.wav,2.424,THEY ATE IN SILENCE,sample-15,sample-153553,scottish,train.csv
/data/mtseng/voice_datasets/CommonVoice_v11/data/sample-15/wav/sample-153776.wav,3.216,MY DOG IS AN ALSATIAN WE CALL HER 'POPPY',sample-15,sample-153776,scottish,train.csv
/data/mtseng/voice_datasets/CommonVoice_v11/data/sample-15/wav/sample-154204.wav,3.744,IN THOSE DAYS VERY FEW OF THE PEOPLE HAD ANY IDEA ABOUT ASTRONOMY,sample-15,sample-154204,scottish,train.csv
/data/mtseng/voice_datasets/CommonVoice_v11/data/sample-15/wav/sample-154613.wav,7.464,BUT THE MARKETPLACE WAS EMPTY AND HE WAS FAR FROM HOME SO HE WEPT,sample-15,sample-154613,scottish,train.csv
/data/mtseng/voice_datasets/CommonVoice_v11/data/sample-15/wav/sample-154836.wav,11.544,BEFORE THIS I ALWAYS LOOKED TO THE DESERT WITH LONGING SAID FATIMA,sample-15,sample-154836,scottish,train.csv
/data/mtseng/voice_datasets/CommonVoice_v11/data/sample-15/wav/sample-154927.wav,7.56,HE DIDN'T CONSIDER MENDING THE HOLE THE STONES COULD FALL THROUGH ANY TIME THEY WANTED,sample-15,sample-154927,scottish,train.csv
/data/mtseng/voice_datasets/CommonVoice_v11/data/sample-15/wav/sample-155151.wav,1.944,WHO SAYS I'M LOOKING FOR A JOB,sample-15,sample-155151,scottish,train.csv
/data/mtseng/voice_datasets/CommonVoice_v11/data/sample-15/wav/sample-155430.wav,4.536,THE LONDONERS REGRETTED VISITING THIS AWFUL PLACE,sample-15,sample-155430,scottish,train.csv
/data/mtseng/voice_datasets/CommonVoice_v11/data/sample-15/wav/sample-155570.wav,3.456,I OWN MY OWN HOUSE,sample-15,sample-155570,scottish,train.csv
/data/mtseng/voice_datasets/CommonVoice_v11/data/sample-15/wav/sample-155762.wav,6.816,AT THAT POINT IN THEIR LIVES EVERYTHING IS CLEAR AND EVERYTHING IS POSSIBLE,sample-15,sample-155762,scottish,train.csv
/data/mtseng/voice_datasets/CommonVoice_v11/data/sample-15/wav/sample-156143.wav,2.904,JUST THE WAY YOURS DO WHEN YOU'RE HAPPY,sample-15,sample-156143,scottish,train.csv
/data/mtseng/voice_datasets/CommonVoice_v11/data/sample-15/wav/sample-156375.wav,5.184,THE WAR CONTINUED AND AT TIMES THE WIND CARRIED THE SWEET SICKLY SMELL OF BLOOD,sample-15,sample-156375,scottish,train.csv
